{
  "$schema": "https://agent-taskboard.local/schemas/wiki-document-companion.schema.json",
  "schemaVersion": "wiki-document-companion/v1",
  "title": "Actors and processes",
  "source": {
    "path": "docs/operations/haertung-verteilte-ausfuehrung/target-architecture/actors.md",
    "type": "markdown",
    "fingerprint": {
      "algorithm": "sha256",
      "hash": "444132cd6539a1e36bd00bf33559eaec20d17d386988fee14dc25b9e9294b06e",
      "sizeBytes": 1616,
      "lineCount": 20,
      "capturedAt": "2026-07-24T21:17:41Z"
    }
  },
  "classification": {
    "owner": "distributed-execution",
    "documentMode": "vision",
    "temporalState": "future",
    "implementationState": "partial",
    "status": "aktuell",
    "supersededBy": null,
    "type": "konzept",
    "analyzedAt": "2026-07-24"
  }
}
