{
  "$schema": "https://agent-taskboard.local/schemas/wiki-document-companion.schema.json",
  "schemaVersion": "wiki-document-companion/v1",
  "title": "Frontend SCSS quality — refactor evaluation 2026-05-17",
  "source": {
    "path": "docs/frontend/audits/scss-quality-eval-2026-05-17.md",
    "type": "markdown",
    "fingerprint": {
      "algorithm": "sha256",
      "hash": "4a47a030f8a7f7880c7b6c687080d64db3e2491df04ba1f4d6227d39cbb7a193",
      "sizeBytes": 25180,
      "lineCount": 484,
      "capturedAt": "2026-07-18T18:45:50.483Z"
    }
  },
  "classification": {
    "owner": "frontend",
    "documentMode": "documentation",
    "temporalState": "past",
    "implementationState": "unknown",
    "status": "veraltet",
    "supersededBy": null,
    "type": "analyse",
    "analyzedAt": "2026-07-18"
  }
}
