{
  "$schema": "https://agent-taskboard.local/schemas/wiki-document-companion.schema.json",
  "schemaVersion": "wiki-document-companion/v1",
  "title": "Frontend architecture review — 2026-05-09",
  "source": {
    "path": "docs/quality/frontend/audits/architecture-review-2026-05-09.md",
    "type": "markdown",
    "fingerprint": {
      "algorithm": "sha256",
      "hash": "f672e46974c158b1fc760edecdb9a28041e9dda761f8d4a8ef409b5011b539df",
      "sizeBytes": 11608,
      "lineCount": 221,
      "capturedAt": "2026-07-18T18:45:50.478Z"
    }
  },
  "classification": {
    "owner": "frontend",
    "documentMode": "documentation",
    "temporalState": "past",
    "implementationState": "unknown",
    "status": "veraltet",
    "supersededBy": null,
    "type": "analyse",
    "analyzedAt": "2026-07-18"
  }
}
