{
  "$schema": "https://agent-taskboard.local/schemas/wiki-document-companion.schema.json",
  "schemaVersion": "wiki-document-companion/v1",
  "title": "Workstream (fixed five-area frame, retired)",
  "source": {
    "path": "docs/concepts/engineering-workstream.md",
    "type": "markdown",
    "fingerprint": {
      "algorithm": "sha256",
      "hash": "d8cedb304d09266bce7a8c2bc006644cbca17d05fa0b8581e29413046424191d",
      "sizeBytes": 15633,
      "lineCount": 280,
      "capturedAt": "2026-07-19T09:00:00.000Z"
    }
  },
  "classification": {
    "owner": "concepts",
    "documentMode": "documentation",
    "temporalState": "past",
    "implementationState": "removed",
    "status": "ueberholt",
    "supersededBy": "contracts/wiki-tree.md",
    "type": "konzept",
    "analyzedAt": "2026-07-19"
  },
  "relatedTasks": [
    {
      "key": "AGT-1987",
      "title": "EW-2: Engineering Workstream - Collector als Pipeline-Step",
      "linkedAt": "2026-07-11T00:17:57.9295611Z",
      "source": "auto"
    }
  ]
}
