{
  "$schema": "https://agent-taskboard.local/schemas/wiki-document-companion.schema.json",
  "schemaVersion": "wiki-document-companion/v1",
  "title": "Task Progress Tracking - Mockup",
  "source": {
    "path": "docs/mockups/task-progress-tracking/README.md",
    "type": "markdown",
    "fingerprint": {
      "algorithm": "sha256",
      "hash": "d963e2563b69560e912f4c66c1417288d36aac4cb5946fdd61c7a76545b9a67f",
      "sizeBytes": 8335,
      "lineCount": 98,
      "capturedAt": "2026-07-18T18:45:50.504Z"
    }
  },
  "classification": {
    "owner": "mockups",
    "documentMode": "documentation",
    "temporalState": "past",
    "implementationState": "unknown",
    "status": "veraltet",
    "supersededBy": null,
    "type": "mockup",
    "analyzedAt": "2026-07-18"
  }
}
