{
  "$schema": "https://agent-taskboard.local/schemas/wiki-document-companion.schema.json",
  "schemaVersion": "wiki-document-companion/v1",
  "title": "UI Tooltip Audit & Canonical Standard",
  "source": {
    "path": "docs/quality/frontend/audits/tooltip-audit.md",
    "type": "markdown",
    "fingerprint": {
      "algorithm": "sha256",
      "hash": "bf5746c0a0b5da9ec24f4c98602c7e8d4f6a6906addb65af5192c48e5e4f4be6",
      "sizeBytes": 11823,
      "lineCount": 181,
      "capturedAt": "2026-07-18T18:45:50.488Z"
    }
  },
  "classification": {
    "owner": "frontend",
    "documentMode": "documentation",
    "temporalState": "past",
    "implementationState": "unknown",
    "status": "veraltet",
    "supersededBy": null,
    "type": "analyse",
    "analyzedAt": "2026-07-18"
  }
}
