{
  "$schema": "https://agent-taskboard.local/schemas/wiki-document-companion.schema.json",
  "schemaVersion": "wiki-document-companion/v1",
  "title": "The three contracts (plus one)",
  "source": {
    "path": "docs/operations/haertung-verteilte-ausfuehrung/target-architecture/contracts.md",
    "type": "markdown",
    "fingerprint": {
      "algorithm": "sha256",
      "hash": "e2d51e9130f1552cf37e95b0514db527785a73adf68d8d19d64285d95211fedb",
      "sizeBytes": 991,
      "lineCount": 8,
      "capturedAt": "2026-07-24T21:17:41Z"
    }
  },
  "classification": {
    "owner": "distributed-execution",
    "documentMode": "mixed",
    "temporalState": "mixed",
    "implementationState": "partial",
    "status": "aktuell",
    "supersededBy": null,
    "type": "contract",
    "analyzedAt": "2026-07-24"
  }
}
